<!ELEMENT liga (equipo)+>
<!ELEMENT equipo (nombre, puntos)>
	<!ATTLIST equipo cod #CDATA #REQUIRED>
	<!ELEMENT nombre (#PCDATA)>
	<!ELEMENT puntos (#PCDATA)>